{
  "url": "https://www.leafly.com/strains/amg",
  "name": "AMG",
  "awards": [],
  "effects": [
    "euphoric",
    "happy",
    "energetic"
  ],
  "flavors": [
    "spicy/herbal",
    "orange",
    "tropical"
  ],
  "lineage": [
    "Amnesia Haze",
    "Biker OG"
  ],
  "medical": [
    "anxiety",
    "depression",
    "fatigue"
  ],
  "terpenes": [
    "linalool"
  ],
  "grow_info": {
    "yield": "medium",
    "height": "medium",
    "difficulty": "moderate",
    "flowering_time_weeks": null
  },
  "cbd_percent": null,
  "description": "AMG is a 70% sativa and 30% indica weed strain made from a genetic cross between Amnesia Haze and Biker OG. This strain is a citrusy and stimulating hybrid that offers a cerebral and energetic high. AMG has a lemony and herbal aroma with hints of diesel and spice. The buds are fluffy and frosty, with neon green and orange hues. AMG is 26% THC, making this strain an ideal choice for experienced cannabis consumers. Leafly customers tell us AMG effects include euphoric, happy, and energetic. Medical marijuana patients often choose AMG when dealing with symptoms associated with stress, depression, and hypertension. Bred by Pearl Pharma, AMG features flavors like spicy/herbal, orange, and tropical. The dominant terpene of this strain is linalool. The average price of AMG typically ranges from $15-$20 per gram. If youâ€™re looking for a citrusy and stimulating hybrid that can help you feel euphoric and happy, AMG might be the strain for you.",
  "thc_percent": 26,
  "rating_count": 8,
  "average_rating": 4.9,
  "classification": "Hybrid"
}