{
  "url": "https://www.leafly.com/strains/blood-orange",
  "name": "Blood Orange",
  "awards": [],
  "effects": [
    "talkative",
    "focused",
    "energetic"
  ],
  "flavors": [
    "orange",
    "apricot",
    "honey"
  ],
  "lineage": [
    "Appalachia",
    "Cali Orange Bud"
  ],
  "medical": [
    "anxiety",
    "depression",
    "stress"
  ],
  "terpenes": [
    "caryophyllene",
    "limonene",
    "linalool"
  ],
  "grow_info": {
    "yield": "medium",
    "height": "medium",
    "difficulty": "moderate",
    "flowering_time_weeks": null
  },
  "cbd_percent": null,
  "description": "Blood Orange is a sativa-dominant hybrid weed strain made from a genetic cross between Appalachia and Cali Orange Bud. Bred by Bodhi Seeds, Blood Orange is 21% THC, making this strain an ideal choice for experienced cannabis consumers. Leafly customers tell us Blood Orange effects make them feel talkative, focused, and energetic. Medical marijuana patients often choose Blood Orange when dealing with symptoms associated with stress, anxiety, and depression. The dominant terpene of this cannabis strain is caryophyllene. Blood Orange features an aroma and flavor profile of orange, apricot, and honey.",
  "thc_percent": 21,
  "rating_count": 30,
  "average_rating": 4.6,
  "classification": "Hybrid"
}