{
  "url": "https://www.leafly.com/strains/blueberry-gelato",
  "name": "Blueberry Gelato",
  "awards": [],
  "effects": [
    "relaxed",
    "creative",
    "hungry"
  ],
  "flavors": [
    "grape",
    "blueberry",
    "pine"
  ],
  "lineage": [
    "Thin Mint Girl Scout Cookies",
    "Blueberry"
  ],
  "medical": [
    "depression",
    "insomnia",
    "nausea"
  ],
  "terpenes": [
    "pinene",
    "myrcene",
    "caryophyllene"
  ],
  "grow_info": {
    "yield": "medium",
    "height": "medium",
    "difficulty": "easy",
    "flowering_time_weeks": null
  },
  "cbd_percent": 0,
  "description": "Blueberry Gelato is an indica-dominant hybrid weed strain made from a genetic cross between Thin Mint Girl Scout Cookies and Blueberry. Blueberry Gelato is 15% THC, making this strain an ideal choice for beginner cannabis consumers. Leafly customers tell us Blueberry Gelato effects make them feel relaxed, creative, and hungry. Medical marijuana patients often choose Blueberry Gelato when dealing with symptoms associated with depression, insomnia, and nausea. The dominant terpene of this cannabis strain is pinene. Blueberry Gelato features an aroma and flavor profile of grape, blueberry, and pine.",
  "thc_percent": 15,
  "rating_count": 25,
  "average_rating": 4.2,
  "classification": "Hybrid"
}