{
  "url": "https://www.leafly.com/strains/cadillac-rainbow",
  "name": "Cadillac Rainbow",
  "awards": [],
  "effects": [
    "Relaxed",
    "Euphoric",
    "Happy"
  ],
  "flavors": [
    "Diesel",
    "Citrus",
    "Sweet"
  ],
  "lineage": [
    "Pure Michigan",
    "Runtz"
  ],
  "medical": [
    "Anxiety",
    "Stress",
    "Depression"
  ],
  "terpenes": [
    "Myrcene",
    "Linalool"
  ],
  "grow_info": {
    "yield": "medium",
    "height": "medium",
    "difficulty": "moderate",
    "flowering_time_weeks": null
  },
  "cbd_percent": null,
  "description": "Cadillac Rainbow is a hybrid weed strain made from a genetic cross between Pure Michigan and Runtz. This strain is a gassy and fruity hybrid that has a lemon and diesel flavor with hints of cherry and mint. Cadillac Rainbow is 37.54% THC, making this strain an ideal choice for experienced cannabis consumers. Leafly customers tell us Cadillac Rainbow effects include relaxed, euphoric, and hungry. Medical marijuana patients often choose Cadillac Rainbow when dealing with symptoms associated with pain, depression, and lack of appetite. Bred by 3rd Coast Genetics, Cadillac Rainbow features flavors like diesel, citrus, and sweet. The dominant terpene of this strain is unknown, but it may contain some myrcene or linalool based on its aroma and effects. This strain is a potent and relaxing hybrid that can help you feel happy and hungry while enjoying its gassy and fruity flavor and aroma.",
  "thc_percent": 37.54,
  "rating_count": 86,
  "average_rating": 4.6,
  "classification": "Hybrid"
}