{
  "url": "https://www.leafly.com/strains/candy-queen",
  "name": "Candy Queen",
  "awards": [],
  "effects": [
    "happy",
    "giggly",
    "uplifted"
  ],
  "flavors": [
    "sweet",
    "earthy",
    "lime"
  ],
  "lineage": [
    "Candy Kush",
    "Space Queen"
  ],
  "medical": [
    "stress",
    "depression",
    "anxiety"
  ],
  "terpenes": [
    "myrcene"
  ],
  "grow_info": {
    "yield": "medium",
    "height": "medium",
    "difficulty": "easy",
    "flowering_time_weeks": null
  },
  "cbd_percent": null,
  "description": "Candy Queen is a hybrid weed strain made from a genetic cross between Candy Kush and Space Queen. This strain is 70% sativa and 30% indica. Candy Queen has a unique flavor profile of candied apples and sweet cherry, counterbalanced by more tame earthy notes. Candy Queen is 14.84% THC, making this strain an ideal choice for beginners. Leafly customers tell us Candy Queen effects include feeling happy, giggly, and uplifted. Medical marijuana patients often choose Candy Queen when dealing with symptoms associated with stress, depression, and anxiety. Bred by Falcanna, Candy Queen features flavors like sweet, apple, and lime. The dominant terpene of this strain is myrcene, which is often associated with a fruity aroma. Candy Queen is a rare and exotic strain that will invigorate your mind and body with a euphoric high.",
  "thc_percent": 14.84,
  "rating_count": 1,
  "average_rating": 4,
  "classification": "Hybrid"
}