{
  "url": "https://www.leafly.com/strains/carbon-fiber",
  "name": "Carbon Fiber",
  "awards": [],
  "effects": [
    "talkative",
    "relaxed",
    "aroused"
  ],
  "flavors": [
    "pepper",
    "earthy",
    "chemical"
  ],
  "lineage": [
    "Grape Pie",
    "Biscotti",
    "Cookies and Cream"
  ],
  "medical": [
    "anxiety",
    "depression",
    "stress"
  ],
  "terpenes": [
    "caryophyllene",
    "limonene",
    "pinene"
  ],
  "grow_info": {
    "yield": "medium",
    "height": "medium",
    "difficulty": "moderate",
    "flowering_time_weeks": null
  },
  "cbd_percent": null,
  "description": "Carbon Fiber is a hybrid weed strain made from a genetic cross between Grape Pie, Biscotti, and Cookies and Cream. Carbon Fiber is 24% THC and 1% CBG, making this strain an ideal choice for moderate and experienced cannabis consumers. Leafly customers tell us Carbon Fiber effects include talkative, aroused, and euphoric. Medical marijuana patients often choose Carbon Fiber when dealing with symptoms associated with lack of appetite, anxiety, and depression. Bred by the incomparable Cannarado Genetics, Carbon Fiber features flavors like pepper, earthy, and chemical. The dominant terpene of this strain is caryophyllene.",
  "thc_percent": 24,
  "rating_count": 92,
  "average_rating": 4.7,
  "classification": "Hybrid"
}