{
  "url": "https://www.leafly.com/strains/chocolate-oranges",
  "name": "Chocolate Oranges",
  "awards": [],
  "effects": [
    "Uplifted",
    "Focused",
    "Happy",
    "Talkative",
    "Tingly",
    "Giggly"
  ],
  "flavors": [
    "Lemon",
    "Pine",
    "Wood",
    "Mint",
    "Orange"
  ],
  "lineage": [
    "Mint Chocolate Chip",
    "Orange Valley OG"
  ],
  "medical": [
    "Anxiety",
    "Depression",
    "Stress",
    "Pain"
  ],
  "terpenes": [
    "Terpinolene",
    "Myrcene",
    "Caryophyllene"
  ],
  "grow_info": {
    "yield": "medium",
    "height": "medium",
    "difficulty": "moderate",
    "flowering_time_weeks": null
  },
  "cbd_percent": null,
  "description": "Chocolate Oranges is a indica-dominant hybrid weed strain made from a genetic cross between Mint Chocolate Chip and Orange Valley OG. Bred by Exotic Genetix, Chocolate Oranges is 21% THC, making this strain an ideal choice for experienced cannabis consumers. Leafly customers tell us Chocolate Oranges effects make them feel talkative, tingly, and giggly. Medical marijuana patients often choose Chocolate Oranges when dealing with symptoms associated with pain, anxiety, and depression. The dominant terpene of this cannabis strain is terpinolene. Chocolate Oranges features an aroma and flavor profile of lemon, pine, and wood.",
  "thc_percent": 21,
  "rating_count": 16,
  "average_rating": 4.4,
  "classification": "Hybrid"
}