{
  "url": "https://www.leafly.com/strains/cookies-and-chem",
  "name": "Cookies and Chem",
  "awards": [],
  "effects": [
    "Relaxed",
    "Focused",
    "Euphoric"
  ],
  "flavors": [
    "Apricot",
    "Chemical",
    "Pepper"
  ],
  "lineage": [
    "GSC",
    "Stardawg",
    "Starfighter"
  ],
  "medical": [
    "Stress",
    "Pain",
    "Depression"
  ],
  "terpenes": [
    "Caryophyllene",
    "Myrcene",
    "Limonene"
  ],
  "grow_info": {
    "yield": "medium",
    "height": "medium",
    "difficulty": "moderate",
    "flowering_time_weeks": null
  },
  "cbd_percent": null,
  "description": "Cookies and Chem, also called Cookies n Chem, is a hybrid weed strain made from a genetic cross between GSC, Stardawg, and Starfighter. Cookies and Chem is 24% THC and 1% CBG, making this strain an ideal choice for experienced cannabis consumers who want a pep in their step. Leafly customers tell us Cookies n Chem effects include uplifted, focused, and euphoric. Medical marijuana patients often choose Cookies and Chem when dealing with symptoms associated with pain, anxiety, and stress. Bred by Greenpoint Seeds, Cookies and Chem features flavors like apricot, chemical, and pepper. The dominant terpene of this strain is limonene.",
  "thc_percent": 24,
  "rating_count": 31,
  "average_rating": 4.5,
  "classification": "Hybrid"
}