{
  "url": "https://www.leafly.com/strains/funky-fresh",
  "name": "Funky Fresh",
  "awards": [],
  "effects": [
    "happy",
    "sleepy",
    "relaxed"
  ],
  "flavors": [
    "sweet",
    "earthy",
    "pine",
    "citrus",
    "berry",
    "mint"
  ],
  "lineage": [
    "Frosted Runtz",
    "Gelato 41"
  ],
  "medical": [
    "stress",
    "insomnia",
    "chronic pain"
  ],
  "terpenes": [
    "caryophyllene"
  ],
  "grow_info": {
    "yield": "medium",
    "height": "medium",
    "difficulty": "moderate",
    "flowering_time_weeks": null
  },
  "cbd_percent": null,
  "description": "Funky Fresh is an indica-dominant weed strain made from a genetic cross between Frosted Runtz and Gelato 41. This strain is 70% indica and 30% sativa. Funky Fresh lives up to its name with a funky and fresh aroma that combines sweet, earthy, and pine notes. Funky Fresh has a high THC content of 35.25%, making this strain an ideal choice for experienced cannabis consumers. Leafly customers tell us Funky Fresh effects include feeling relaxed, blissful, and pain-free. Medical marijuana patients often choose Funky Fresh when dealing with symptoms associated with stress, insomnia, and chronic pain. Bred by Cream of the Crop Gardens, Funky Fresh features flavors like citrus, berry, and mint. The dominant terpene of this strain is caryophyllene, which may have anti-inflammatory and analgesic properties. The average price of Funky Fresh typically ranges from $40-$60 for an eighth of an ounce. Funky Fresh is a rare and exclusive strain that is only available in select dispensaries in California.",
  "thc_percent": 35.25,
  "rating_count": 2,
  "average_rating": 3,
  "classification": "Hybrid"
}