{
  "url": "https://www.leafly.com/strains/galactic-grape",
  "name": "Galactic Grape",
  "awards": [],
  "effects": [
    "euphoric",
    "relaxed",
    "creative",
    "aroused",
    "talkative"
  ],
  "flavors": [
    "fruity",
    "gassy",
    "citrus",
    "earthy",
    "pine"
  ],
  "lineage": [
    "Grape Diamonds",
    "Stardawg IX"
  ],
  "medical": [
    "anxiety",
    "depression",
    "stress"
  ],
  "terpenes": [
    "limonene",
    "caryophyllene",
    "linalool"
  ],
  "grow_info": {
    "yield": "medium",
    "height": "medium",
    "difficulty": "moderate",
    "flowering_time_weeks": null
  },
  "cbd_percent": 0,
  "description": "Galactic Grape is a hybrid weed strain made from a genetic cross between Grape Diamonds and Stardawg IX. This strain is 50% sativa and 50% indica. Galactic Grape has a fruity and gassy flavor and aroma that will make your mouth water. This strain may make you feel euphoric, relaxed, and creative with its balanced effects. Galactic Grape has a THC content of 16%, making this strain an ideal choice for beginners and experienced cannabis consumers alike. Leafly customers tell us Galactic Grape effects include feeling aroused, talkative, and euphoric. Medical marijuana patients often choose Galactic Grape when dealing with symptoms associated with anxiety and depression. Bred by Vertical Cannabis, Galactic Grape features flavors like citrus, earthy, and pine. The dominant terpene of this strain is pinene, which may have anti-inflammatory and bronchodilator properties. The average price of Galactic Grape typically ranges from $10-$15 per gram. Galactic Grape is a rare and exotic strain that is only available in select dispensaries in California. If youâ€™re looking for a strain that will take you to the stars with its flavor and potency, give Galactic Grape a try.",
  "thc_percent": 16,
  "rating_count": 4,
  "average_rating": 4.8,
  "classification": "Hybrid"
}