{
  "url": "https://www.leafly.com/strains/grandpas-stash",
  "name": "Grandpa’s Stash",
  "awards": [],
  "effects": [
    "Relaxed",
    "Happy",
    "Euphoric"
  ],
  "flavors": [
    "Skunk",
    "Earthy",
    "Tobacco"
  ],
  "lineage": [
    "Super Skunk",
    "OG Kush",
    "Afghan Kush"
  ],
  "medical": [
    "Anxiety",
    "Depression",
    "Stress"
  ],
  "terpenes": [
    "Myrcene",
    "Limonene",
    "Caryophyllene"
  ],
  "grow_info": {
    "yield": "medium",
    "height": "medium",
    "difficulty": "moderate",
    "flowering_time_weeks": null
  },
  "cbd_percent": 0,
  "description": "Grandpa’s Stash is a hybrid weed strain made from a genetic cross between the classics: 1994 Super Skunk, 1992 OG Kush, and a 1970s cut of Afghan Kush. Grandpa’s Stash is 20% THC, making this strain an ideal choice for experienced cannabis consumers. Leafly customers tell us Grandpa’s Stash’s effects include relaxed, happy, and tingly. Medical marijuana patients often choose Grandpa’s Stash when dealing with symptoms associated with anxiety, depression, and stress. Bred by Ethos Genetics, Grandpa’s Stash features flavors like tobacco, skunk, and pine. The dominant terpene of this strain is myrcene.",
  "thc_percent": 20,
  "rating_count": 84,
  "average_rating": 4.5,
  "classification": "Hybrid"
}