{
  "url": "https://www.leafly.com/strains/grape-cream-cake",
  "name": "Grape Cream Cake",
  "awards": [
    "Runner-up for Leafly's Strain of the Year in 2023"
  ],
  "effects": [
    "Relaxed",
    "Tingly",
    "Happy"
  ],
  "flavors": [
    "Vanilla",
    "Grape",
    "Nutty"
  ],
  "lineage": [
    "Grape Pie",
    "Wedding Crasher"
  ],
  "medical": [
    "Anxiety",
    "Stress",
    "Pain"
  ],
  "terpenes": [
    "Myrcene",
    "Caryophyllene",
    "Linalool"
  ],
  "grow_info": {
    "yield": "medium",
    "height": "medium",
    "difficulty": "moderate",
    "flowering_time_weeks": null
  },
  "cbd_percent": null,
  "description": "Grape Cream Cake is an indica weed strain made from a genetic cross between Grape Pie and Wedding Crasher strains. This strain has a delicious flavor and aroma that combine the fruity notes of grapes and cherries with a hint of nutty vanilla. Grape Cream Cake is 20-25% THC, making this strain an ideal choice for experienced cannabis consumers. Leafly customers tell us Grape Cream Cake effects include relaxed, happy, and sleepy. Medical marijuana patients often choose Grape Cream Cake when dealing with symptoms associated with chronic pain, insomnia, and stress. Bred by Bloom Seed Co, Grape Cream Cake features flavors like grape, cherry, and vanilla. The dominant terpene of this strain is unknown. Grape Cream Cake is a heavy-hitting indica-dominant hybrid that is known for its sweet and fruity flavors of grape and cherry, followed by rich notes of nutty vanilla. This strain has a dense and frosty appearance with purple hues and a coating of trichomes. Grape Cream Cake was a runner-up for Leafly's Strain of the Year in 2023.",
  "thc_percent": 23,
  "rating_count": 51,
  "average_rating": 4.7,
  "classification": "Indica"
}