{
  "url": "https://www.leafly.com/strains/guava-cake",
  "name": "Guava Cake",
  "awards": [],
  "effects": [
    "Tingly",
    "Relaxed",
    "Aroused"
  ],
  "flavors": [
    "Tropical",
    "Tree fruit",
    "Sweet"
  ],
  "lineage": [
    "Wedding Cake"
  ],
  "medical": [
    "Anxiety",
    "Depression",
    "Stress"
  ],
  "terpenes": [
    "Caryophyllene"
  ],
  "grow_info": {
    "yield": "medium",
    "height": "medium",
    "difficulty": "moderate",
    "flowering_time_weeks": null
  },
  "cbd_percent": null,
  "description": "Guava Cake is a hybrid marijuana strain believed to be made through a special cross of Wedding Cake. This strain is more calming than energizing. The effects of Guava Cake will make you feel tingly, aroused, and giggly. Leafly users report this strain may give you dry mouth, so try to enjoy Guava Cake with a glass of water. Some consumers look for this strain when experiencing mild symptoms associated with depression, stress, and fatigue. Guava Cake has a tropical flavor profile with sweet notes of pear and tree fruit. The THC content in Guava Cake varies from 28% to 30%, making this strain a good choice for experienced THC consumers. The original breeder of this strain is unknown. The dominant terpene in Guava Cake is believed to be caryophyllene.",
  "thc_percent": 29,
  "rating_count": 50,
  "average_rating": 4.5,
  "classification": "Hybrid"
}