{
  "url": "https://www.leafly.com/strains/ice-cream-mintz",
  "name": "Ice Cream Mintz",
  "awards": [],
  "effects": [
    "hungry",
    "giggly",
    "happy",
    "relaxed"
  ],
  "flavors": [
    "vanilla",
    "mint",
    "violet"
  ],
  "lineage": [
    "Ice Cream Cake",
    "Kush Mints"
  ],
  "medical": [
    "anxiety",
    "depression",
    "stress"
  ],
  "terpenes": [
    "limonene",
    "caryophyllene",
    "linalool"
  ],
  "grow_info": {
    "yield": "medium",
    "height": "medium",
    "difficulty": "moderate",
    "flowering_time_weeks": null
  },
  "cbd_percent": null,
  "description": "Ice Cream Mintz, also known as Ice Cream Mints, is an indica weed strain made from a genetic cross between Ice Cream Cake and Kush Mints. Ice Cream Mintz can test as high as 26% THC, making this strain an ideal choice for very experienced cannabis consumers. Leafly customers tell us Ice Cream Mintz effects include hungry, giggly, and happy. Medical marijuana patients often choose Ice Cream Mintz when dealing with symptoms associated with anxiety, stress, and depression. Bred by Seed Junky, Ice Cream Mintz features flavors like vanilla, mint, and violet. The dominant terpene of this strain is limonene.",
  "thc_percent": 26,
  "rating_count": 28,
  "average_rating": 4.5,
  "classification": "Indica"
}