{
  "url": "https://www.leafly.com/strains/jelly-breath",
  "name": "Jelly Breath",
  "awards": [],
  "effects": [
    "relaxed",
    "tingly",
    "euphoric",
    "sleepy"
  ],
  "flavors": [
    "earthy",
    "fruity",
    "sweet",
    "floral",
    "berry"
  ],
  "lineage": [
    "Mendo Breath",
    "Do-Si-Dos"
  ],
  "medical": [
    "anxiety",
    "depression",
    "insomnia",
    "muscle spasms"
  ],
  "terpenes": [
    "caryophyllene",
    "myrcene",
    "limonene"
  ],
  "grow_info": {
    "yield": "medium",
    "height": "medium",
    "difficulty": "moderate",
    "flowering_time_weeks": null
  },
  "cbd_percent": null,
  "description": "Jelly Breath is an Indica-dominant hybrid weed strain made from a genetic cross between Mendo Breath and Do-Si-Dos. Bred by In House Genetics, Jelly Breath is 21% THC, making this strain an ideal choice for experienced cannabis consumers. Leafly customers tell us Jelly Breath effects are relaxing, tingly, and euphoric. Medical marijuana patients often choose Jelly Breath when dealing with symptoms associated with insomnia, depression, and muscle spasms. The dominant terpene of this cannabis strain is limonene. Jelly Breath features an aroma that is floral with notes of berries and a flavor profile that is earthy, fruity, and sweet.",
  "thc_percent": 21,
  "rating_count": 68,
  "average_rating": 4.6,
  "classification": "Hybrid"
}