{
  "url": "https://www.leafly.com/strains/kush-mints",
  "name": "Kush Mints",
  "awards": [],
  "effects": [
    "Relaxed",
    "Aroused",
    "Euphoric"
  ],
  "flavors": [
    "Mint",
    "Menthol",
    "Pine"
  ],
  "lineage": [
    "Animal Mints",
    "Bubba Kush"
  ],
  "medical": [
    "Anxiety",
    "Stress",
    "Depression"
  ],
  "terpenes": [
    "Limonene",
    "Caryophyllene",
    "Linalool"
  ],
  "grow_info": {
    "yield": "medium",
    "height": "short to medium",
    "difficulty": "easy",
    "flowering_time_weeks": 8
  },
  "cbd_percent": null,
  "description": "Kush Mints is a hybrid weed strain made from a genetic cross between Animal Mints and Bubba Kush. This strain is 50% sativa and 50% indica. Kush Mints is a potent and flavorful strain that has a minty and cookie-like aroma and flavor, with hints of gas and pine. It has a balanced high that is both relaxing and euphoric, with a pleasant body buzz and a creative mind. Kush Mints is 28% THC, making this strain an ideal choice for experienced cannabis consumers. Leafly customers tell us Kush Mints effects include feeling relaxed, euphoric, and aroused. Medical marijuana patients often choose Kush Mints when dealing with symptoms associated with anxiety, stress, and depression. Bred by Mr. Nice Seeds, Kush Mints features flavors like mint, menthol, and pine. The dominant terpene of this strain is limonene.",
  "thc_percent": 28,
  "rating_count": 467,
  "average_rating": 4.6,
  "classification": "Hybrid"
}