{
  "url": "https://www.leafly.com/strains/larry-bird-kush",
  "name": "Larry Bird",
  "awards": [],
  "effects": [
    "uplifted",
    "relaxed",
    "happy"
  ],
  "flavors": [
    "sweet",
    "lemon",
    "cream",
    "pine"
  ],
  "lineage": [
    "Sunset Sherbet",
    "Thin Mint Girl Scout Cookies"
  ],
  "medical": [
    "anxiety",
    "stress",
    "depression"
  ],
  "terpenes": [
    "caryophyllene"
  ],
  "grow_info": {
    "yield": "medium",
    "height": "medium",
    "difficulty": "moderate",
    "flowering_time_weeks": null
  },
  "cbd_percent": null,
  "description": "Larry Bird is a hybrid weed strain named after the famous Boston Celtics basketball player that is made from a genetic cross between Sunset Sherbet with Thin Mint Girl Scout Cookies. Bred by Zamnesia Seeds, Larry Bird is 17% THC, making this strain an ideal choice for both beginner and experienced cannabis consumers. Leafly customers tell us Larry Bird effects make them feel relaxed, creative, and euphoric. Medical marijuana patients often choose Larry Bird when dealing with symptoms associated with stress, depression, and chronic pain. The dominant terpene of this cannabis strain is caryophyllene. Larry Bird features an aroma of cream and pine as well as a flavor profile that is sweet with a lemon tang.",
  "thc_percent": 17,
  "rating_count": 80,
  "average_rating": 4.7,
  "classification": "Hybrid"
}