{
  "url": "https://www.leafly.com/strains/lemon-zkittle",
  "name": "Lemon Zkittle",
  "awards": [],
  "effects": [
    "relaxed",
    "giggly",
    "happy",
    "tingly",
    "creative"
  ],
  "flavors": [
    "citrus",
    "lemon",
    "mint"
  ],
  "lineage": [
    "Las Vegas Lemon Skunk",
    "Zkittlez"
  ],
  "medical": [
    "anxiety",
    "depression",
    "pain"
  ],
  "terpenes": [
    "limonene",
    "caryophyllene",
    "linalool"
  ],
  "grow_info": {
    "yield": "medium",
    "height": "medium",
    "difficulty": "moderate",
    "flowering_time_weeks": null
  },
  "cbd_percent": null,
  "description": "Lemon Zkittle is a indica-dominant hybrid weed strain made from a genetic cross between Las Vegas Lemon Skunk and Zkittlez. Bred by Dutch Passion, Lemon Zkittle is 23% THC, making this strain an ideal choice for experienced cannabis consumers. Leafly customers tell us Lemon Zkittle effects make them feel relaxed, giggly, and happy. Medical marijuana patients often choose Lemon Zkittle when dealing with symptoms associated with anxiety, depression, and insomnia. The dominant terpene of this cannabis strain is limonene. Lemon Zkittle features an aroma and flavor profile of citrus, lemon, and mint.",
  "thc_percent": 23,
  "rating_count": 32,
  "average_rating": 4.6,
  "classification": "Hybrid"
}