{
  "url": "https://www.leafly.com/strains/london-poundcake",
  "name": "London Pound Cake",
  "awards": [],
  "effects": [
    "sleepy",
    "tingly",
    "relaxed"
  ],
  "flavors": [
    "butter",
    "vanilla",
    "lemon"
  ],
  "lineage": [
    "Sunset Sherbert",
    "unknown heavy-hitting indica"
  ],
  "medical": [
    "anxiety",
    "depression",
    "stress"
  ],
  "terpenes": [
    "caryophyllene",
    "limonene",
    "myrcene"
  ],
  "grow_info": {
    "yield": "medium",
    "height": "medium",
    "difficulty": "moderate",
    "flowering_time_weeks": null
  },
  "cbd_percent": null,
  "description": "London Pound Cake, also known as “Pound Cake”, is an indica-dominant weed strain made from a genetic cross between Sunset Sherbert and an unknown heavy-hitting indica. London Pound Cake is a potent and delicious strain that offers a smooth and relaxing high. Bred by Cookies, London Pound Cake combines the best of both parents, delivering a sweet and spicy flavor with a diesel and nutty undertone. London Pound Cake is 20% THC, making this strain an ideal choice for experienced cannabis consumers. Leafly customers tell us London Pound Cake effects include sleepy, relaxed, and tingly. Medical marijuana patients often choose London Pound Cake when dealing with symptoms associated with anxiety, depression, and stress. Bred by Cookies, London Pound Cake features flavors like vanilla, butter, and lemon. The dominant terpene of this strain is myrcene. The average price of London Pound Cake typically ranges from $10-$20 per gram. If you’re looking for a tasty and soothing strain that can ease your mind and body, London Pound Cake might be the perfect choice for you.",
  "thc_percent": 20,
  "rating_count": 329,
  "average_rating": 4.6,
  "classification": "Hybrid"
}