{
  "url": "https://www.leafly.com/strains/los-muertos",
  "name": "Los Muertos",
  "awards": [],
  "effects": [
    "Euphoric",
    "Happy",
    "Relaxed"
  ],
  "flavors": [
    "Creamy",
    "Woodsy",
    "Spicy",
    "Gassy"
  ],
  "lineage": [
    "Motorbreath",
    "Project 4516"
  ],
  "medical": [
    "Anxiety",
    "Insomnia",
    "Muscle spasms"
  ],
  "terpenes": [
    "Caryophyllene"
  ],
  "grow_info": {
    "yield": "medium",
    "height": "medium",
    "difficulty": "moderate",
    "flowering_time_weeks": null
  },
  "cbd_percent": null,
  "description": "Los Muertos is a hybrid weed strain made from a genetic cross between Motorbreath and Project 4516. This strain is 50% sativa and 50% indica. Los Muertos is a loud and gassy strain that can produce a blissful state of relaxation. This strain is so potent that it could probably wake the dead. Los Muertos is 19-28% THC, making this strain an ideal choice for experienced cannabis consumers. Leafly customers tell us Los Muertos effects include feeling happy, euphoric, and sleepy. Medical marijuana patients often choose Los Muertos when dealing with symptoms associated with chronic pain, insomnia, and stress. Bred by Hytek, Los Muertos features flavors like creamy, woodsy, spicy, and gassy. The dominant terpene of this strain is caryophyllene, which is known for its anti-inflammatory and analgesic properties. The average price of Los Muertos typically ranges from $10-$15 per gram. Los Muertos is a rare and powerful strain that can help you unwind and enjoy the moment. It has dense and sticky buds with purple hues and a thick layer of trichomes.",
  "thc_percent": 28,
  "rating_count": 5,
  "average_rating": 5,
  "classification": "Hybrid"
}