{
  "url": "https://www.leafly.com/strains/orange-kush",
  "name": "Orange Kush",
  "awards": [],
  "effects": [
    "euphoric",
    "happy",
    "sleepy",
    "relaxed",
    "hungry"
  ],
  "flavors": [
    "pungent",
    "citrus",
    "sweet",
    "orange",
    "woody"
  ],
  "lineage": [
    "Orange Bud",
    "OG Kush"
  ],
  "medical": [
    "Stress",
    "Anxiety",
    "Pain",
    "ADD/ADHD",
    "Insomnia"
  ],
  "terpenes": [
    "terpinolene",
    "pinene",
    "caryophyllene"
  ],
  "grow_info": {
    "yield": "medium",
    "height": "medium",
    "difficulty": "easy",
    "flowering_time_weeks": 8
  },
  "cbd_percent": 0,
  "description": "Orange Kush, also known as \"Orange OG,\" is an indica marijuana strain made by crossing Orange Bud and OG Kush. Orange Kush is 18% THC, making this weed strain an ideal choice for beginner cannabis consumers. The effects of Orange Kush is euphoric and eases the body into relaxation. Leafly customers tell us Orange Kush effects make them feel happy and sleepy. Bred by Green Devil Genetics, the dominant terpene of this strain is terpinolene. Orange Kush features a pungent and citrus aroma with a sweet orange and woody flavor. Medical marijuana patients often choose Orange Kush when dealing with symptoms associated with ADD/ADHD, anxiety, and insomnia.",
  "thc_percent": 18,
  "rating_count": 827,
  "average_rating": 4.1,
  "classification": "Indica"
}