{
  "url": "https://www.leafly.com/strains/orange-cookies",
  "name": "Orange Cookies",
  "awards": [],
  "effects": [
    "Relaxed",
    "Happy",
    "Euphoric"
  ],
  "flavors": [
    "Orange",
    "Citrus",
    "Sweet"
  ],
  "lineage": [
    "Orange Juice",
    "Girl Scout Cookies"
  ],
  "medical": [
    "Stress",
    "Anxiety",
    "Depression"
  ],
  "terpenes": [
    "Terpinolene",
    "Myrcene",
    "Caryophyllene"
  ],
  "grow_info": {
    "yield": "medium",
    "height": "medium",
    "difficulty": "moderate",
    "flowering_time_weeks": null
  },
  "cbd_percent": null,
  "description": "Orange Cookies is a sativa-dominant hybrid marijuana strain made by crossing Orange Juice with the renowned Girl Scout Cookies. The result is a flavor-packed strain that will remind you of a sweet and juicy tangerine. The effects of Orange Cookies are calming and long-lasting. Consumers who smoke Orange Cookies say it provides a euphoric and cerebral head buzz that leaves you in a happy mood while your body remains relaxed. Orange Cookies is around 25% THC, making it a suitable strain choice for cannabis consumers of all experience levels. According to growers, this strain flowers into compact buds that appear lumpy with light green foliage. The average price of a gram of Orange Cookies ranges from $12 to $17. The dominant terpene of Orange Cookies is Terpinolene. According to Leafly users, medical marijuana patients often choose this strain to relieve symptoms associated with stress, depression, and anxiety. Orange Cookies was originally bred by Franchise Genetics.",
  "thc_percent": 25,
  "rating_count": 540,
  "average_rating": 4.6,
  "classification": "Hybrid"
}