{
  "url": "https://www.leafly.com/strains/original-glue",
  "name": "GG4",
  "awards": [
    "1st place in Michigan Cannabis Cup 2014",
    "1st place in Los Angeles Cannabis Cup 2014",
    "High Times Jamaican World Cup 2015"
  ],
  "effects": [
    "Relaxed",
    "Sleepy",
    "Hungry"
  ],
  "flavors": [
    "Pungent",
    "Earthy",
    "Pine"
  ],
  "lineage": [
    "Chem’s Sister",
    "Sour Dubb",
    "Chocolate Diesel"
  ],
  "medical": [
    "Stress",
    "Anxiety",
    "Pain"
  ],
  "terpenes": [
    "Caryophyllene",
    "Myrcene",
    "Limonene"
  ],
  "grow_info": {
    "yield": "high",
    "height": "short to average",
    "difficulty": "moderate",
    "flowering_time_weeks": "9-10"
  },
  "cbd_percent": 0,
  "description": "Original Glue is a hybrid weed strain made from a genetic cross between Chem’s Sister, Sour Dubb, and Chocolate Diesel. This strain is 37% sativa and 63% indica. Also known as “GG4”, Original Glue is a potent strain that delivers heavy-handed euphoria and relaxation, leaving you feeling “glued” to the couch. Its chunky, resin-covered buds fill the room with pungent earthy and sour aromas inherited from its parent strains. Original Glue is 20% THC, making this strain an ideal choice for experienced cannabis consumers. Leafly customers tell us Original Glue effects include feeling relaxed, sleepy, and hungry. Medical marijuana patients often choose Original Glue when dealing with symptoms associated with stress, anxiety, and pain. Bred by GG Strains LLC, Original Glue features flavors like pungent, pine, and earthy. The dominant terpene of this strain is caryophyllene. The average price of Original Glue typically ranges from $10-$15 per gram. Original Glue is a multiple award-winning strain that has taken first place in both the Michigan and Los Angeles 2014 Cannabis Cups, as well as the High Times Jamaican World Cup in 2015. It is a fast-growing strain that produces large yields of sticky buds with a flowering time of 9-10 weeks.",
  "thc_percent": 20,
  "rating_count": 5441,
  "average_rating": 4.6,
  "classification": "Hybrid"
}