{
  "url": "https://www.leafly.com/strains/platinum-gorilla",
  "name": "Platinum Gorilla",
  "awards": [],
  "effects": [
    "Hungry",
    "Aroused",
    "Relaxed"
  ],
  "flavors": [
    "Chemical",
    "Earthy",
    "Diesel"
  ],
  "lineage": [
    "Platinum Kush",
    "GG4"
  ],
  "medical": [
    "Depression",
    "Anxiety",
    "Stress"
  ],
  "terpenes": [
    "Caryophyllene",
    "Limonene",
    "Humulene"
  ],
  "grow_info": {
    "yield": "high",
    "height": "medium",
    "difficulty": "moderate",
    "flowering_time_weeks": null
  },
  "cbd_percent": null,
  "description": "Platinum Gorilla is an indica-dominant hybrid weed strain made from a genetic cross between Platinum Kush and GG4. This strain is 70% indica and 30% sativa. Platinum Gorilla is also known as Platinum Glue or Platinum GG, and is a frosty and sticky strain that has a pungent, earthy, and diesel flavor and aroma. Platinum Gorilla is 25% THC and 1% CBG, making this strain a strong choice for experienced cannabis consumers who can handle a potent high. Leafly customers tell us Platinum Gorilla effects include feeling hungry, relaxed, and aroused. Medical marijuana patients often choose Platinum Gorilla when dealing with symptoms associated with stress, anxiety, and depression. Bred by unknown breeders, Platinum Gorilla features flavors like ammonia, butter, and chemical. The dominant terpene of this strain is caryophyllene. The average price of Platinum Gorilla typically ranges from $40-$60 per eighth. Platinum Gorilla has a heavy and sedating high that can stimulate your appetite and your senses. This strain is best enjoyed at night or when you need a deep relaxation.",
  "thc_percent": 25,
  "rating_count": 16,
  "average_rating": 4.7,
  "classification": "Hybrid"
}