{
  "url": "https://www.leafly.com/strains/raspberry-skywalker",
  "name": "Raspberry Skywalker",
  "awards": [],
  "effects": [
    "happy",
    "relaxed",
    "hungry",
    "energetic",
    "uplifted"
  ],
  "flavors": [
    "raspberry",
    "lemon",
    "pine",
    "sweet"
  ],
  "lineage": [
    "Raspberry",
    "Skywalker OG"
  ],
  "medical": [
    "depression",
    "anxiety",
    "arthritis",
    "stress",
    "pain",
    "nausea",
    "insomnia"
  ],
  "terpenes": [
    "myrcene"
  ],
  "grow_info": {
    "yield": "medium",
    "height": "medium",
    "difficulty": "moderate",
    "flowering_time_weeks": null
  },
  "cbd_percent": null,
  "description": "Raspberry Skywalker is a hybrid weed strain made from a genetic cross between Raspberry and Skywalker OG. This strain is 50% sativa and 50% indica. Raspberry Skywalker is a fruity and gassy strain that delivers a balanced high of relaxation and euphoria. This strain is known to stimulate the appetite and help with insomnia. Raspberry Skywalker is 18% THC, making this strain an ideal choice for beginners and experienced cannabis consumers alike. Leafly customers tell us Raspberry Skywalker effects include feeling happy, relaxed, and hungry. Medical marijuana patients often choose Raspberry Skywalker when dealing with symptoms associated with stress, pain, and nausea. Bred by National Cannabis Company, Raspberry Skywalker features flavors like raspberry, lemon, and pine. The dominant terpene of this strain is myrcene. The average price of Raspberry Skywalker typically ranges from $30-$50 per gram. If youâ€™re looking for a sweet and potent strain that can help you unwind and enjoy a snack, Raspberry Skywalker might be the one for you.",
  "thc_percent": 18,
  "rating_count": 8,
  "average_rating": 4.6,
  "classification": "Hybrid"
}