{
  "url": "https://www.leafly.com/strains/raspberry-parfait",
  "name": "Raspberry Parfait",
  "awards": [],
  "effects": [
    "creative",
    "talkative",
    "uplifted"
  ],
  "flavors": [
    "plum",
    "berries",
    "violet"
  ],
  "lineage": [
    "Truffula-tree",
    "Shishkaberry"
  ],
  "medical": [
    "anxiety",
    "depression",
    "pain"
  ],
  "terpenes": [
    "terpinolene",
    "myrcene",
    "caryophyllene"
  ],
  "grow_info": {
    "yield": "medium",
    "height": "medium",
    "difficulty": "moderate",
    "flowering_time_weeks": null
  },
  "cbd_percent": null,
  "description": "Raspberry Parfait is a sativa-dominant hybrid weed strain made from a genetic cross between Truffula-tree and Shishkaberry. Bred by Humboldt Seed Company, Raspberry Parfait is 21% THC, making this strain an ideal choice for experienced cannabis consumers. Leafly customers tell us Raspberry Parfait effects make them feel creative, talkative, and uplifted. Medical marijuana patients often choose Raspberry Parfait when dealing with symptoms associated with pain, stress, and anxiety. The dominant terpene of this cannabis strain is terpinolene. Raspberry Parfait features an aroma and flavor profile of plum, berries, and violet.",
  "thc_percent": 21,
  "rating_count": 59,
  "average_rating": 4.5,
  "classification": "Hybrid"
}