{
  "url": "https://www.leafly.com/strains/red-bullz",
  "name": "Red Bullz",
  "awards": [],
  "effects": [
    "energetic",
    "aroused",
    "focused"
  ],
  "flavors": [
    "fruity",
    "spicy",
    "gassy",
    "apple",
    "berry",
    "diesel"
  ],
  "lineage": [
    "Grape Gas",
    "White Runtz"
  ],
  "medical": [
    "bipolar disorder",
    "depression",
    "PTSD",
    "inflammation"
  ],
  "terpenes": [],
  "grow_info": {
    "yield": "medium",
    "height": "medium",
    "difficulty": "moderate",
    "flowering_time_weeks": null
  },
  "cbd_percent": null,
  "description": "Red Bullz is a hybrid weed strain made from a genetic cross between Grape Gas and White Runtz. This strain is 50% sativa and 50% indica. Red Bullz is a new strain from Compound Genetics that was released in 2022. Red Bullz has a fruity, spicy, and gassy flavor and aroma that resembles grape candy. Red Bullz is 25% THC, making this strain a strong choice for experienced cannabis consumers who can handle a potent high. Leafly customers tell us Red Bullz effects include feeling creative, aroused, and focused. Medical marijuana patients often choose Red Bullz when dealing with symptoms associated with bipolar disorder, depression, and inflammation. Bred by Compound Genetics, Red Bullz features flavors like apple, berry, and diesel. The dominant terpene of this strain is unknown. The average price of Red Bullz typically ranges from $40-$60 per eighth. Red Bullz has a cerebral and stimulating high that can boost your energy and mood. This strain is best enjoyed during the day or when you need a burst of creativity and motivation.",
  "thc_percent": 25,
  "rating_count": 22,
  "average_rating": 4.4,
  "classification": "Hybrid"
}