{
  "url": "https://www.leafly.com/strains/the-soap",
  "name": "The Soap",
  "awards": [],
  "effects": [
    "Aroused",
    "Focused",
    "Energetic"
  ],
  "flavors": [
    "Mint",
    "Pine",
    "Cheese"
  ],
  "lineage": [
    "Animal Mints",
    "Kush Mints"
  ],
  "medical": [
    "Anxiety",
    "Depression",
    "Stress"
  ],
  "terpenes": [
    "Caryophyllene",
    "Limonene",
    "Linalool"
  ],
  "grow_info": {
    "yield": "medium",
    "height": "medium",
    "difficulty": "moderate",
    "flowering_time_weeks": null
  },
  "cbd_percent": null,
  "description": "The Soap, not to be confused with Zoap, is a hybrid weed strain made from a genetic cross between Animal Mints and Kush Mints. The Soap is 19% THC, making this strain an ideal choice for beginner cannabis consumers. Leafly customers tell us The Soap effects include focus, feeling energized, and arousal. Medical marijuana patients often choose The Soap when dealing with symptoms associated with stress, anxiety, and depression. Bred by Seed Junky Genetics and Bernerâ€™s Cookies, The Soap features flavors like mint, pine and cheese. The dominant terpene of this strain is caryophyllene followed by limonene.",
  "thc_percent": 24,
  "rating_count": 140,
  "average_rating": 4.6,
  "classification": "Hybrid"
}