{
  "url": "https://www.leafly.com/strains/titty-sprinkles",
  "name": "Titty Sprinkles",
  "awards": [],
  "effects": [
    "happy",
    "sleepy",
    "tingly"
  ],
  "flavors": [
    "chemical",
    "berry",
    "diesel"
  ],
  "lineage": [
    "Grease Monkey",
    "Purple Punch 2.0"
  ],
  "medical": [
    "anxiety",
    "insomnia",
    "arthritis"
  ],
  "terpenes": [
    "caryophyllene",
    "limonene",
    "pinene"
  ],
  "grow_info": {
    "yield": "medium",
    "height": "medium",
    "difficulty": "easy",
    "flowering_time_weeks": null
  },
  "cbd_percent": null,
  "description": "Titty Sprinkles is a indica-dominant weed strain made from a genetic cross between Grease Monkey and Purple Punch 2.0. Titty Sprinkles is 16% THC and 1% CBG, making this strain an ideal choice for beginner cannabis consumers and medical patients; the strain was bred to raise awareness for breast cancer. Leafly customers tell us Titty Sprinkles effects include happy, sleepy, and tingly. Medical marijuana patients often choose Titty Sprinkles when dealing with symptoms associated with anxiety, insomnia, and arthritis. Bred by Secret Society Seed Co., Titty Sprinkles features flavors like diesel, berry, and chemical. The dominant terpene of this strain is caryophyllene.",
  "thc_percent": 16,
  "rating_count": 48,
  "average_rating": 4.7,
  "classification": "Indica"
}