{
  "url": "https://www.leafly.com/strains/triple-burger",
  "name": "Triple Burger",
  "awards": [],
  "effects": [
    "relaxed",
    "sleepy",
    "tingly"
  ],
  "flavors": [
    "ammonia",
    "butter",
    "chemical"
  ],
  "lineage": [
    "GMO",
    "Double Burger"
  ],
  "medical": [
    "pain",
    "stress",
    "anxiety"
  ],
  "terpenes": [
    "caryophyllene",
    "humulene",
    "limonene"
  ],
  "grow_info": {
    "yield": "medium",
    "height": "medium",
    "difficulty": "moderate",
    "flowering_time_weeks": null
  },
  "cbd_percent": null,
  "description": "Triple Burger is a mostly indica weed strain made from a genetic cross between GMO and Double Burger. This strain is a creation of Skunk House Genetics, a breeder known for producing potent and gassy strains. Triple Burger has a pungent aroma of garlic, butter, and diesel that will fill the room. Triple Burger is 23% THC, making this strain an ideal choice for experienced cannabis consumers. Leafly customers tell us Triple Burger effects include relaxed, sleepy, and tingly. Medical marijuana patients often choose Triple Burger when dealing with symptoms associated with insomnia, pain, and stress. Bred by Skunk House Genetics, Triple Burger features flavors like ammonia, butter, and blue cheese. The dominant terpene of this strain is caryophyllene. The average price of Triple Burger typically ranges from $50-$70 per eighth. Triple Burger is a great strain to enjoy at night, as it will make you feel calm and cozy. This strain also has a sedating and numbing effect that can help you fall asleep faster and deeper.",
  "thc_percent": 25,
  "rating_count": 43,
  "average_rating": 4.7,
  "classification": "Indica"
}