{
  "url": "https://www.leafly.com/strains/tropical-smoothie",
  "name": "Tropical Smoothie",
  "awards": [],
  "effects": [
    "energetic",
    "uplifted",
    "euphoric"
  ],
  "flavors": [
    "tropical",
    "pineapple",
    "citrus",
    "sweet"
  ],
  "lineage": [
    "Pineapple",
    "Cookies"
  ],
  "medical": [
    "anxiety",
    "stress",
    "depression"
  ],
  "terpenes": [
    "Myrcene"
  ],
  "grow_info": {
    "yield": "medium",
    "height": "medium",
    "difficulty": "moderate",
    "flowering_time_weeks": null
  },
  "cbd_percent": null,
  "description": "Tropical Smoothie is a hybrid weed strain made from a genetic cross between Pineapple and Cookies strains. This strain is 50% sativa and 50% indica, offering a balanced experience that combines the best of both worlds. Tropical Smoothie typically contains 18-22% THC, making it suitable for both beginners and experienced cannabis consumers. Its effects, as reported by Leafly customers, include feeling relaxed, uplifted, and creative, making it an appealing choice for various activities and moods. Medical marijuana patients often choose Tropical Smoothie to manage symptoms associated with stress, anxiety, and depression, thanks to its mood-enhancing properties. Additionally, its relaxing qualities can provide relief from physical discomfort. Tropical Smoothie features flavors reminiscent of tropical fruits, with notes of pineapple, citrus, and a hint of sweetness. The dominant terpene of this strain is Myrcene, contributing to its calming effects.",
  "thc_percent": 20,
  "rating_count": 3,
  "average_rating": 4,
  "classification": "Hybrid"
}