{
  "url": "https://www.leafly.com/strains/tropicana-haze",
  "name": "Tropicana Haze",
  "awards": [],
  "effects": [
    "talkative",
    "uplifted",
    "happy"
  ],
  "flavors": [
    "mango",
    "tropical",
    "orange"
  ],
  "lineage": [
    "Skunk Valley Haze",
    "Tropicana Cookies"
  ],
  "medical": [
    "pain",
    "stress",
    "depression"
  ],
  "terpenes": [
    "caryophyllene",
    "myrcene",
    "ocimene"
  ],
  "grow_info": {
    "yield": "medium",
    "height": "medium",
    "difficulty": "moderate",
    "flowering_time_weeks": null
  },
  "cbd_percent": null,
  "description": "Tropicana Haze is a Sativa-dominant hybrid weed strain made from a genetic cross between Skunk Valley Haze and Tropicana Cookies. Tropicana Haze is 24% THC, making this strain an ideal choice for both beginner and experienced cannabis consumers. Leafly customers tell us Tropicana Haze effects make them feel talkative, uplifted, and happy. Medical marijuana patients often choose Tropicana Haze when dealing with symptoms associated with pain, stress, and depression. The dominant terpene of this cannabis strain is myrcene. Tropicana Haze features an aroma and flavor profile of mango, tropical, and orange.",
  "thc_percent": 24,
  "rating_count": 19,
  "average_rating": 4.6,
  "classification": "Hybrid"
}