{
  "url": "https://www.leafly.com/strains/tropical-cherry",
  "name": "Tropical Cherry",
  "awards": [],
  "effects": [
    "energetic",
    "talkative",
    "focused"
  ],
  "flavors": [
    "sweet",
    "citrus",
    "nutty",
    "berry",
    "tropical",
    "tea"
  ],
  "lineage": [
    "Tropicana Cookies",
    "Cherry Cookies"
  ],
  "medical": [
    "anxiety",
    "pain",
    "depression"
  ],
  "terpenes": [
    "caryophyllene",
    "limonene",
    "linalool"
  ],
  "grow_info": {
    "yield": "medium",
    "height": "medium",
    "difficulty": "moderate",
    "flowering_time_weeks": 9
  },
  "cbd_percent": null,
  "description": "Tropical Cherry is a hybrid weed strain made from a genetic cross between Tropicana Cookies and Cherry Cookies. This strain is 60% sativa and 40% indica. Tropical Cherry is a modern marijuana strain from Relentless Genetics, a Colorado-based breeder. It has a sweet and sour citrus profile with a flavor of ripe cherries and nutty earthiness. It may produce sativa-like effects of euphoria, mood enhancement, and energy. Tropical Cherry is 24% THC and 1% CBG, making this strain an ideal choice for experienced cannabis consumers. Leafly customers tell us Tropical Cherry effects include feeling focused, happy, and relaxed. Medical marijuana patients often choose Tropical Cherry when dealing with symptoms associated with anxiety, pain, and depression. Bred by Relentless Genetics, Tropical Cherry features flavors like berry, tropical, and tea. The dominant terpene of this strain is terpinolene, which gives it a fruity and floral aroma. The average price of Tropical Cherry typically ranges from $40-$60 for an eighth of an ounce. Tropical Cherry has a beautiful appearance, with large buds covered in white trichomes and orange hairs. It flowers in 63-70 days.",
  "thc_percent": 24,
  "rating_count": 44,
  "average_rating": 4.7,
  "classification": "Hybrid"
}