{
  "url": "https://www.leafly.com/strains/truffle-monkey",
  "name": "Truffle Monkey",
  "awards": [],
  "effects": [
    "relaxed",
    "happy",
    "euphoric",
    "energetic",
    "creative",
    "focused",
    "paranoid",
    "anxious"
  ],
  "flavors": [
    "earthy",
    "fruity",
    "gassy",
    "ammonia",
    "butter",
    "blue cheese",
    "diesel",
    "flowery",
    "grapefruit"
  ],
  "lineage": [
    "Grease Monkey",
    "Tropic Truffles"
  ],
  "medical": [
    "stress",
    "depression",
    "anxiety",
    "insomnia",
    "pain"
  ],
  "terpenes": [
    "caryophyllene"
  ],
  "grow_info": {
    "yield": "medium",
    "height": "medium",
    "difficulty": "moderate",
    "flowering_time_weeks": null
  },
  "cbd_percent": null,
  "description": "Truffle Monkey is a hybrid weed strain made from a genetic cross between Grease Monkey and Tropic Truffles. This strain is a creation of Exotic Genetix, a renowned breeder known for producing exotic and flavorful strains. Truffle Monkey has a complex aroma of earthy, fruity, and gassy notes that will tantalize your senses. Truffle Monkey is 24% THC, making this strain an ideal choice for experienced cannabis consumers. Leafly customers tell us Truffle Monkey effects include relaxed, happy, and euphoric. Medical marijuana patients often choose Truffle Monkey when dealing with symptoms associated with insomnia, pain, and stress. Bred by Exotic Genetix, Truffle Monkey features flavors like ammonia, butter, and blue cheese. The dominant terpene of this strain is caryophyllene. Truffle Monkey is a great strain to enjoy in the evening, as it will make you feel calm and cozy. This strain also has a stimulating and creative effect that can help you explore new ideas or hobbies.",
  "thc_percent": 24,
  "rating_count": 9,
  "average_rating": 4,
  "classification": "Hybrid"
}