{
  "url": "https://www.leafly.com/strains/wonka-bars",
  "name": "Wonka Bars",
  "awards": [],
  "effects": [
    "Giggly",
    "Energetic",
    "Focused"
  ],
  "flavors": [
    "Nutty",
    "Butter",
    "Mint"
  ],
  "lineage": [
    "Garlic Cookies (aka GMO Cookies)",
    "Mint Chocolate Chip"
  ],
  "medical": [
    "Anxiety",
    "Stress",
    "Depression"
  ],
  "terpenes": [
    "Myrcene",
    "Limonene",
    "Caryophyllene"
  ],
  "grow_info": {
    "yield": "high",
    "height": "medium",
    "difficulty": "moderate",
    "flowering_time_weeks": null
  },
  "cbd_percent": null,
  "description": "Wonka Bars, also known as \"Wonka Bar,\" is a sativa-dominant hybrid marijuana strain developed from a clever cross between Garlic Cookies (aka GMO Cookies) and Mint Chocolate Chip. The effects of Wonka Bars are energizing, making this an ideal strain for any wake and bake session. Consumers say Wonka Bars makes them feel giggly, mentally stimulated, and motivated to be social or perform creative tasks. The flavor is tasty, with a sweet and skunky theme backed up by earthy undertones. Wonka Bars is 20% THC and best reserved for cannabis consumers with a high THC tolerance. Wonka Bars dominant terpene is Myrcene, making it a popular choice among medical marijuana patients looking to relieve symptoms associated with chronic anxiety, depression, and stress. The average cost of one gram of Wonka Bars ranges from $12-$18. According to growers, this strain flowers into beautiful dark purple and orange nugs with thick trichomes. Wonka Bars will grow medium-tall and produce heavy yields that will please any grower. Since its inception, new variations of Wonka Bars have emerged, including Wonka Bars #13. This strain was originally bred by Exotix Genetix.",
  "thc_percent": 20,
  "rating_count": 72,
  "average_rating": 4.6,
  "classification": "Hybrid"
}